course_id,place,title,image,text
2aaf63d9-fbcb-421c-a540-420087e28e17,1,Penerapan Model Machine Learning dalam Sistem Produksi,/image/data.png,"Setelah model Machine Learning terbentuk dan divalidasi, maka tahap selanjutnya adalah penerapan model dalam sistem produksi agar dapat digunakan untuk memecahkan masalah di dunia nyata."
8bcef1f5-dfc2-4bd4-bc86-aaa53f088986,1,Proyek Pertama,/image/data.png,Proyek pertama pada Machine Learning adalah bagian penting dalam belajar karena memungkinkan kita untuk mengaplikasikan konsep yang telah dipelajari pada kasus nyata.
f582e608-580f-47de-84b8-5c3aed1d8a6f,1,Python Clean Code,/image/data.png,"Clean Code adalah praktik penulisan kode yang membuat kode mudah dibaca, dimengerti, dan dipelihara. Hal ini membantu meningkatkan kualitas dan kemudahan pengembangan pada proyek Machine Learning."
2da60ea4-426f-476d-9efe-bf9a2275bc07,1,Pengenalan HTML,/image/web.png,HTML (Hyper Text Markup Language) adalah bahasa markup yang digunakan untuk membuat halaman web. Bahasa ini memungkinkan pengembang untuk menentukan struktur dan konten dari halaman web.
e8cd3f1b-f5f2-48d8-9a32-ba89c1b54964,1,Pendalaman HTML,/image/web.png,"Pada tingkat yang lebih dalam, HTML memiliki berbagai elemen dan atribut yang dapat digunakan untuk membuat halaman web yang lebih kompleks dan interaktif."
5a99fbc1-c863-4f3f-b9a9-36b5994bbafb,1,Pengenalan CSS,/image/web.png,CSS (Cascading Style Sheets) adalah bahasa style sheet yang digunakan untuk mendesain tampilan halaman web. Bahasa ini memungkinkan pengembang untuk menentukan bagaimana elemen pada halaman web akan ditampilkan.
c5bd5b8b-2b19-449b-9241-ae2d8a2daf49,1,Pendalaman CSS,/image/web.png,"Pendalaman CSS adalah upaya untuk memahami CSS secara lebih mendalam, sehingga dapat membuat desain website yang lebih kreatif dan interaktif. Hal ini meliputi memahami CSS selector, properti, dan nilai, serta cara menata dan mengelola style sheet. Pemahaman yang baik tentang CSS akan membantu Anda membuat tampilan website yang menarik dan responsif."
a8f6ccbc-e08b-4f5e-85a9-73e0bb051c24,1,Layout Responsif dengan Flexbox,/image/web.png,"Flexbox adalah teknik layout responsif yang memungkinkan penggunaan tata letak berbasis grid, baik secara horizontal maupun vertikal. Dengan memahami Flexbox, Anda dapat membangun desain website yang responsif dengan mudah. Anda dapat mengatur posisi elemen HTML, memperbaiki margin dan padding, dan mengubah ukuran elemen HTML dalam waktu singkat."
1e5eab81-8959-43e4-b6f2-de584cfe90cf,1,Pengenalan JavaScript,/image/web.png,"JavaScript adalah bahasa pemrograman yang sering digunakan untuk membuat efek interaktif pada website. Pemahaman dasar tentang JavaScript akan membantu Anda membuat efek-efek sederhana seperti slideshow, menu dropdown, dan validasi form. JavaScript juga digunakan dalam membangun aplikasi web, sehingga pemahaman yang baik tentang bahasa ini akan sangat bermanfaat."
efe91caa-60aa-4982-852e-054bc12831a6,1,Fundamental JavaScript,/image/web.png,"Fundamental JavaScript meliputi pemahaman tentang variabel, tipe data, operator, dan struktur kontrol. Pemahaman dasar tentang hal-hal tersebut akan membantu Anda membangun script JavaScript yang efektif dan efisien. Selain itu, Anda juga akan mempelajari cara membuat fungsi, mengelola string, mengoperasikan array, dan memahami objek."
eb90e0d7-a42f-454b-b9ad-0fe5eeb8ba8b,1,Struktur Data,/image/web.png,"Struktur data adalah cara penyimpanan dan pengorganisasian data dalam komputer. Pemahaman yang baik tentang struktur data akan membantu Anda membangun program yang lebih efisien dan efektif. Anda akan mempelajari tentang array, stack, queue, linked list, dan tree. Selain itu, Anda juga akan mempelajari bagaimana cara mengakses dan mengubah data dalam struktur data tersebut."
b9d1d755-1a54-4560-9bda-be0bb4f584fa,1,Function,/image/web.png,"Function adalah blok kode yang dapat dipanggil secara berulang dan dapat menerima input dan mengembalikan output. Pemahaman yang baik tentang function akan membantu Anda membangun script JavaScript yang lebih efektif dan modular. Anda akan mempelajari tentang parameter, penggunaan return statement, scope, dan hoisting."
8052513c-9041-4bb9-9dbd-c4511d1e76b5,1,Object-Oriented Programming (OOP),/image/web.png,"OOP adalah paradigma pemrograman yang berfokus pada objek. Dalam OOP, Anda dapat membuat objek yang memiliki properti dan metode sendiri. Pemahaman yang baik tentang OOP akan membantu Anda membangun program yang lebih modular, mudah dipahami, dan mudah di-maintain. Anda akan mempelajari tentang class, constructor, inheritance, dan polymorphism."
715040b1-7c40-41b7-84c5-a9961f319c72,1,Functional Programming,/image/web.png,"Functional Programming adalah paradigma pemrograman yang fokus pada fungsi. Dalam Functional Programming, Anda dapat menggabungkan fungsi menjadi satu kesatuan yang lebih besar. Pemahaman yang baik tentang Functional Programming akan membantu Anda membangun program yang lebih modular, mudah dipahami, dan mudah di-maintain. Anda akan mempelajari tentang pure function, higher-order function, dan closure."
1d274cdd-aa9f-4725-9ea7-8807b2c60eed,1,Setup Environment,/image/web.png,"Setup Environment meliputi konfigurasi dan pengaturan lingkungan kerja sehingga Anda dapat memulai untuk mengembangkan aplikasi atau website. Lingkungan kerja yang baik akan memudahkan Anda dalam mengembangkan program dan meningkatkan produktivitas Anda. Hal-hal yang perlu dipelajari dalam Setup Environment adalah instalasi text editor, instalasi web server, dan penggunaan command line interface (CLI) untuk mengatur dan memanipulasi file."
220f23cc-de3a-44bd-94f5-22002b98542a,1,Module,/image/web.png,"Module adalah kumpulan kode yang dapat dipakai kembali dan dipisahkan dari kode lain dalam sebuah program. Pemahaman yang baik tentang module akan membantu Anda membuat program yang lebih modular dan mudah di-maintain. Anda akan mempelajari tentang import dan export module, serta cara membuat dan menggunakan module dalam program JavaScript."
9b489b3b-95b1-4e88-8ec8-38b33c6d37cc,1,Penanganan Eror,/image/web.png,"Penanganan eror atau error handling adalah upaya untuk menangani kesalahan yang terjadi dalam sebuah program atau aplikasi. Pemahaman yang baik tentang penanganan eror akan membantu Anda membuat program yang lebih stabil dan terhindar dari kesalahan. Anda akan mempelajari tentang try-catch statement, error object, dan cara menangani eror yang terjadi pada aplikasi."
1de99991-9463-47af-8629-a009a88b493f,1,Asynchronous Process,/image/web.png,"Asynchronous process adalah cara menjalankan beberapa tugas atau fungsi secara bersamaan, tanpa harus menunggu tugas atau fungsi sebelumnya selesai. Pemahaman yang baik tentang asynchronous process akan membantu Anda membuat program yang lebih cepat dan efisien. Anda akan mempelajari tentang callback, promise, dan async/await."
3319b282-5f07-456a-8c4e-537681317fe7,1,Node Package Manager,/image/web.png,"Node Package Manager atau npm adalah alat untuk mengelola paket atau modul pada program JavaScript. Pemahaman yang baik tentang npm akan membantu Anda mengatur dependensi pada program JavaScript dengan baik. Anda akan mempelajari tentang cara instalasi paket, penggunaan package.json, dan cara memanfaatkan modul dari npm."
3f146b50-8fd2-45ff-8be1-4c8adad60540,1,JavaScript Testing,/image/web.png,"JavaScript testing adalah upaya untuk menguji dan memastikan bahwa program JavaScript yang dibuat berjalan dengan baik dan sesuai dengan yang diharapkan. Pemahaman yang baik tentang JavaScript testing akan membantu Anda membuat program yang lebih reliable dan terhindar dari bug. Anda akan mempelajari tentang jenis-jenis testing seperti unit testing, integration testing, dan functional testing, serta alat yang digunakan dalam testing seperti Jest, Mocha, dan Chai."
8411b49d-d82d-43e0-aa13-9c1e0a82c05a,1,Browser Object Model dan Document Object Model,/image/web.png,"Browser Object Model (BOM) dan Document Object Model (DOM) adalah dua model objek penting yang digunakan dalam pengembangan web. BOM menyediakan akses ke fungsi browser seperti pengaturan URL dan ukuran layar, sementara DOM merepresentasikan dokumen HTML dan XML sebagai objek yang dapat dimanipulasi melalui JavaScript untuk membuat interaksi dinamis dan animasi pada halaman web."
40b35cd7-12d5-48c7-86bf-fe83383730b7,1,Firebase untuk Aplikasi Web,/image/web.png,"Firebase adalah platform pengembangan aplikasi mobile dan web yang disediakan oleh Google. Firebase menyediakan berbagai fitur dan layanan yang dapat membantu pengembangan aplikasi web dan mobile menjadi lebih mudah dan efisien. Dalam konteks aplikasi web, Firebase menyediakan fitur-fitur seperti authentication, database, storage, hosting, dan analytics."